{"$id":"https://orbital-dynamics.local/schemas/constraint_report.v1.schema.json","$schema":"https://json-schema.org/draft/2020-12/schema","additionalProperties":true,"allOf":[{"if":{"properties":{"model":{"const":"artifact_metric_threshold"}}},"then":{"properties":{"model_limits":{"const":["artifact_level_only","no_rerun_propagation","missing_or_nil_values_fail","numeric_threshold_violations_can_be_warnings","uses_report_metric_rows"]}}}},{"if":{"properties":{"model":{"const":"campaign_planner_local_constraint_summary"}}},"then":{"properties":{"model_limits":{"const":["planner_local_constraints_only","evaluated_after_candidate_generation_filters","resource_projection_constraints_are_planning_grade","link_capacity_constraints_are_fixed_rate_summaries","not_a_general_constraint_solver"]}}}},{"if":{"properties":{"model":{"const":"campaign_repair_local_constraint_summary"}}},"then":{"properties":{"model_limits":{"const":["planner_local_constraints_only","evaluated_after_candidate_generation_filters","resource_projection_constraints_are_planning_grade","link_capacity_constraints_are_fixed_rate_summaries","not_a_general_constraint_solver"]}}}}],"properties":{"assumptions":{"type":"object"},"constraint_count":{"minimum":0,"type":"integer"},"model":{"enum":["artifact_metric_threshold","campaign_planner_local_constraint_summary","campaign_repair_local_constraint_summary"],"type":"string"},"model_limits":{"items":{"enum":["artifact_level_only","evaluated_after_candidate_generation_filters","link_capacity_constraints_are_fixed_rate_summaries","missing_or_nil_values_fail","no_rerun_propagation","not_a_general_constraint_solver","numeric_threshold_violations_can_be_warnings","planner_local_constraints_only","resource_projection_constraints_are_planning_grade","uses_report_metric_rows"],"type":"string"},"type":"array"},"row_count":{"minimum":0,"type":"integer"},"rows":{"items":{"additionalProperties":true,"properties":{"constraint_id":{"pattern":"^[A-Za-z0-9][A-Za-z0-9._:@-]*$","type":"string"},"metric":{"type":"string"},"operator":{"enum":["<","<=","==",">=",">"],"type":"string"},"scenario_id":{"pattern":"^[A-Za-z0-9][A-Za-z0-9._:@-]*$","type":"string"},"score":{"type":"number"},"status":{"enum":["pass","fail","warning"],"type":"string"},"threshold":{"type":"number"},"value":{"type":"number"}},"required":["constraint_id","scenario_id","metric","operator","threshold","status"],"type":"object"},"type":"array"},"schema_contract":{"const":"constraint_report.v1","description":"Stable executable contract identifier","type":"string"},"status":{"type":"string"},"status_counts":{"type":"object"}},"required":["schema_contract","model","constraint_count","row_count","status","status_counts","rows","assumptions"],"title":"OrbitalDynamics constraint_report.v1","type":"object","x-orbital-dynamics":{"artifact_family":"constraint_report","compatibility_policy":{"breaking_change_action":"mint a new schema_contract name or increment the artifact schema_version before publishing","breaking_changes":["remove_required_fields","change_required_field_type","change_schema_contract_identifier","change_schema_version_const","change_required_field_semantics"],"compatible_changes":["add_optional_fields","add_optional_nested_contracts","tighten_executable_semantic_validation_without_changing_exported_required_fields"],"policy_version":1,"validation_mode":"top_level_compatibility_export"},"compatibility_policy_version":1,"executable_contract":true,"identity_policy":{"breaking_changes":["change_existing_public_identifier_for_the_same_semantic_entity","emit_blank_identifier","emit_identifier_with_whitespace"],"compatible_changes":["add_optional_identifier_fields","add_more_specific_semantic_source_metadata_without_changing_existing_ids"],"description":"Public artifact identifiers are non-empty machine identifiers without whitespace.","generated_id_scopes":[{"identity_fields":["scenario_id","type","source_window_id","target_id","ground_station_id"],"ordering":["result_event_type","scenario_id","source_window_id","starts_at_s"],"scope":"candidate_refresh.v1.candidate_activities"},{"identity_fields":["spacecraft_id","scenario_id","epoch.seconds_since_j2000"],"ordering":["spacecraft_id","scenario_id","epoch.seconds_since_j2000"],"scope":"accepted_planning_state.v1.spacecraft_states"}],"policy_version":1,"semantic_invariants":["source_record_order_must_not_change_generated_identity","semantic_source_identity_must_remain_stable_across_manifest_export","scenario_and_activity_identity_must_not_depend_on_wall_clock_time"],"stable_id_pattern":"^[A-Za-z0-9][A-Za-z0-9._:@-]*$"},"identity_policy_version":1,"nested_contract_definition_scope":"direct_declared_contracts","nested_contracts":[],"schema_contract":"constraint_report.v1","schema_version":1,"validation_mode":"top_level_compatibility_export"}}
